<?xml version="1.0" encoding="UTF-8"?>
<xs:schema xmlns:xs="http://www.w3.org/2001/XMLSchema" elementFormDefault="qualified">
    <xs:element name="personas">
        <xs:complexType>
            <xs:sequence>
                <xs:element name="persona" maxOccurs="unbounded">
                    <xs:complexType>
                        <xs:sequence>
                            <xs:element name="nombre" type="xs:string" />
                            <xs:element name="nacimiento">
                                <xs:complexType>
                                    <xs:sequence>
                                        <xs:element name="dia" type="xs:string" />
                                        <xs:element name="Mes" type="xs:string" />
                                        <xs:element name="Año" type="xs:string" />
                                    </xs:sequence>
                                </xs:complexType>
                            </xs:element>
                            <xs:element name="Dirección">
                                <xs:complexType>
                                    <xs:sequence>
                                        <xs:element name="Calle" type="xs:string" />
                                        <xs:element name="Provincia" type="xs:string" />
                                    </xs:sequence>
                                    <xs:attribute name="CP" type="xs:integer" use="required" />
                                </xs:complexType>
                            </xs:element>
                        </xs:sequence>
                        <xs:attribute name="sexo" use="required" />
                    </xs:complexType>
                </xs:element>
            </xs:sequence>
        </xs:complexType>
    </xs:element>
</xs:schema>